<?xml version="1.0" encoding="UTF-8"?>

<AMLlist xmlns:xsi="http://www.w3.org/2001/XMLSchema-instance"
  xsi:noNamespaceSchemaLocation="AMLlist.xsd">
  <AMLlistEntry>
    <typ>HIERARCHY</typ>
    <scope>GLOBAL</scope>
    <code>GLOBAL</code>
    <dscr>The top of the scope hierarchy</dscr>
    <cdScore>5</cdScore>
  </AMLlistEntry>
  <AMLlistEntry>
    <typ>HIERARCHY</typ>
    <scope>CIB</scope>
    <code>GLOBAL</code>
    <dscr>GFCC have approved CIB localisations</dscr>
    <cdScore>5</cdScore>
  </AMLlistEntry>
  <AMLlistEntry>
    <typ>CUSTOMER_TYPE</typ>
    <scope>GLOBAL</scope>
    <code>CT_010</code>
    <dscr>Individual</dscr>
    <cdScore>3</cdScore>
  </AMLlistEntry>
</AMLlist>
